id,content,ngram,final_features,tfidf_sum
523187577814126592,AÉCIO AÉCIO AÉCIO AÉCIO AÉCIO AÉCIO AÉCIO AÉCIO AÉCIO AÉCIO AÉCIO AÉCIO AÉCIO AÉCIO AÉCIO AÉCIO AÉCIO AÉCIO AÉCIO AÉCIO MIL VEZES AÉCIO! 👊,"['aécio aécio aécio', 'aécio aécio aécio', 'aécio aécio aécio', 'aécio aécio aécio', 'aécio aécio aécio', 'aécio aécio aécio', 'aécio aécio aécio', 'aécio aécio aécio', 'aécio aécio aécio', 'aécio aécio aécio', 'aécio aécio aécio', 'aécio aécio aécio', 'aécio aécio aécio', 'aécio aécio aécio', 'aécio aécio aécio', 'aécio aécio aécio', 'aécio aécio aécio', 'aécio aécio aécio', 'aécio aécio mil', 'aécio mil vezes', 'mil vezes aécio']","(262144,[8229,67967,94768,257453],[156.55842302416156,0.0,9.524368741193442,9.6785194210207])",175.7613111863757
523187577814126592,AÉCIO AÉCIO AÉCIO AÉCIO AÉCIO AÉCIO AÉCIO AÉCIO AÉCIO AÉCIO AÉCIO AÉCIO AÉCIO AÉCIO AÉCIO AÉCIO AÉCIO AÉCIO AÉCIO AÉCIO MIL VEZES AÉCIO! 👊,"['aécio aécio', 'aécio aécio', 'aécio aécio', 'aécio aécio', 'aécio aécio', 'aécio aécio', 'aécio aécio', 'aécio aécio', 'aécio aécio', 'aécio aécio', 'aécio aécio', 'aécio aécio', 'aécio aécio', 'aécio aécio', 'aécio aécio', 'aécio aécio', 'aécio aécio', 'aécio aécio', 'aécio aécio', 'aécio mil', 'mil vezes', 'vezes aécio']","(262144,[116793,219128,233732,252159],[9.273054312912537,8.831221560633498,144.38247970747645,8.525839911082315])",171.01259549210482
523187577814126592,AÉCIO AÉCIO AÉCIO AÉCIO AÉCIO AÉCIO AÉCIO AÉCIO AÉCIO AÉCIO AÉCIO AÉCIO AÉCIO AÉCIO AÉCIO AÉCIO AÉCIO AÉCIO AÉCIO AÉCIO MIL VEZES AÉCIO! 👊,"['aécio aécio aécio aécio', 'aécio aécio aécio aécio', 'aécio aécio aécio aécio', 'aécio aécio aécio aécio', 'aécio aécio aécio aécio', 'aécio aécio aécio aécio', 'aécio aécio aécio aécio', 'aécio aécio aécio aécio', 'aécio aécio aécio aécio', 'aécio aécio aécio aécio', 'aécio aécio aécio aécio', 'aécio aécio aécio aécio', 'aécio aécio aécio aécio', 'aécio aécio aécio aécio', 'aécio aécio aécio aécio', 'aécio aécio aécio aécio', 'aécio aécio aécio aécio', 'aécio aécio aécio mil', 'aécio aécio mil vezes', 'aécio mil vezes aécio']","(262144,[25043,121862,175638,189221],[0.0,0.0,0.0,159.64423492567164])",159.64423492567164
523187577814126592,AÉCIO AÉCIO AÉCIO AÉCIO AÉCIO AÉCIO AÉCIO AÉCIO AÉCIO AÉCIO AÉCIO AÉCIO AÉCIO AÉCIO AÉCIO AÉCIO AÉCIO AÉCIO AÉCIO AÉCIO MIL VEZES AÉCIO! 👊,"['aécio aécio aécio aécio aécio', 'aécio aécio aécio aécio aécio', 'aécio aécio aécio aécio aécio', 'aécio aécio aécio aécio aécio', 'aécio aécio aécio aécio aécio', 'aécio aécio aécio aécio aécio', 'aécio aécio aécio aécio aécio', 'aécio aécio aécio aécio aécio', 'aécio aécio aécio aécio aécio', 'aécio aécio aécio aécio aécio', 'aécio aécio aécio aécio aécio', 'aécio aécio aécio aécio aécio', 'aécio aécio aécio aécio aécio', 'aécio aécio aécio aécio aécio', 'aécio aécio aécio aécio aécio', 'aécio aécio aécio aécio aécio', 'aécio aécio aécio aécio mil', 'aécio aécio aécio mil vezes', 'aécio aécio mil vezes aécio']","(262144,[37821,67726,221210,254373],[0.0,0.0,154.8563107363312,0.0])",154.8563107363312
523544227037593600,"Dilma, Aécio, Dilma, Aécio, Dilma, Aécio, Dilma, Aécio, Dilma, Aécio, Dilma, Aécio, Dilma, Aécio, Dilma, Aécio... não aguento mais 😭😭","['dilma aécio dilma', 'aécio dilma aécio', 'dilma aécio dilma', 'aécio dilma aécio', 'dilma aécio dilma', 'aécio dilma aécio', 'dilma aécio dilma', 'aécio dilma aécio', 'dilma aécio dilma', 'aécio dilma aécio', 'dilma aécio dilma', 'aécio dilma aécio', 'dilma aécio dilma', 'aécio dilma aécio', 'dilma aécio aguento']","(262144,[95102,206736,260609],[9.072383617450384,64.17385658078297,61.335600824025825])",134.58184102225917
523544227037593600,"Dilma, Aécio, Dilma, Aécio, Dilma, Aécio, Dilma, Aécio, Dilma, Aécio, Dilma, Aécio, Dilma, Aécio, Dilma, Aécio... não aguento mais 😭😭","['dilma aécio dilma aécio', 'aécio dilma aécio dilma', 'dilma aécio dilma aécio', 'aécio dilma aécio dilma', 'dilma aécio dilma aécio', 'aécio dilma aécio dilma', 'dilma aécio dilma aécio', 'aécio dilma aécio dilma', 'dilma aécio dilma aécio', 'aécio dilma aécio dilma', 'dilma aécio dilma aécio', 'aécio dilma aécio dilma', 'dilma aécio dilma aécio', 'aécio dilma aécio aguento']","(262144,[56557,222689,225198],[65.73586143998244,55.00616278352826,9.6785194210207])",130.4205436445314
522767021432655872,“@Estadao: Lula ataca Aécio: Como alguém que se recusa a fazer o teste do bafômetro pode governar com decência? ” ÓTIMO ARGUMENTO KKKKK,"['estadao lula', 'lula ataca', 'ataca aécio', 'aécio alguém', 'alguém recusa', 'recusa fazer', 'fazer teste', 'teste bafômetro', 'bafômetro pode', 'pode governar', 'governar decência', 'decência ótimo', 'ótimo argumento', 'argumento kkkkk']","(262144,[846,8064,35424,48926,68038,82617,116337,124447,146464,167103,182322,194489,196561,223623],[8.251403065380556,0.0,8.174442024244426,9.16769379725471,9.524368741193442,9.524368741193442,9.39083734856892,8.985372240460755,9.6785194210207,8.762228689146546,9.273054312912537,8.212182352227273,9.16769379725471,9.273054312912537])",117.38521884377056
522770253269704704,"Eleitores 'deveriam abandonar' Dilma e eleger Aécio, afirma revista 'The Economist' - Economia - Geral - Estadão Mobi http://t.co/mCwn1MMH5A","['eleitores deveriam', 'deveriam abandonar', 'abandonar dilma', 'dilma eleger', 'eleger aécio', 'aécio afirma', 'afirma revista', 'revista the', 'the economist', 'economist economia', 'economia geral', 'geral estadão', 'estadão mobi', 'mobi httptcomcwn1mmh5a']","(262144,[9438,16491,59804,60223,105454,124460,126068,136001,146169,162353,184044,193251,221265,260572],[8.905329532787219,8.29222505990081,8.762228689146546,9.6785194210207,8.379236436890439,9.6785194210207,0.0,9.6785194210207,8.831221560633498,7.973771328782275,8.985372240460755,8.905329532787219,9.16769379725471,9.524368741193442])",116.76233518289904
523544227037593600,"Dilma, Aécio, Dilma, Aécio, Dilma, Aécio, Dilma, Aécio, Dilma, Aécio, Dilma, Aécio, Dilma, Aécio, Dilma, Aécio... não aguento mais 😭😭","['dilma aécio dilma aécio dilma', 'aécio dilma aécio dilma aécio', 'dilma aécio dilma aécio dilma', 'aécio dilma aécio dilma aécio', 'dilma aécio dilma aécio dilma', 'aécio dilma aécio dilma aécio', 'dilma aécio dilma aécio dilma', 'aécio dilma aécio dilma aécio', 'dilma aécio dilma aécio dilma', 'aécio dilma aécio dilma aécio', 'dilma aécio dilma aécio dilma', 'aécio dilma aécio dilma aécio', 'dilma aécio dilma aécio aguento']","(262144,[11966,165810,216869],[58.0711165261242,0.0,58.0711165261242])",116.1422330522484
522814502619062273,"Eleitores 'deveriam abandonar Dilma' e eleger Aécio, afirma revista The Economist - Economia - Geral - Estadão Mobile http://t.co/Twlr1357fm","['eleitores deveriam', 'deveriam abandonar', 'abandonar dilma', 'dilma eleger', 'eleger aécio', 'aécio afirma', 'afirma revista', 'revista the', 'the economist', 'economist economia', 'economia geral', 'geral estadão', 'estadão mobile', 'mobile httptcotwlr1357fm']","(262144,[9438,9545,16491,28950,59804,60223,105454,124460,146169,162353,184044,193251,221265,260572],[8.905329532787219,0.0,8.29222505990081,8.905329532787219,8.762228689146546,9.6785194210207,8.379236436890439,9.6785194210207,8.831221560633498,7.973771328782275,8.985372240460755,8.905329532787219,9.16769379725471,9.524368741193442])",115.98914529466553
522832405854298112,"Eleitores 'deveriam abandonar' Dilma e eleger Aécio, afirma revista The Economist - Economia - Geral - Estadão Mobile http://t.co/Om8AdNSgYh","['eleitores deveriam', 'deveriam abandonar', 'abandonar dilma', 'dilma eleger', 'eleger aécio', 'aécio afirma', 'afirma revista', 'revista the', 'the economist', 'economist economia', 'economia geral', 'geral estadão', 'estadão mobile', 'mobile httptcoom8adnsgyh']","(262144,[9438,16491,24391,28950,59804,60223,105454,124460,146169,162353,184044,193251,221265,260572],[8.905329532787219,8.29222505990081,0.0,8.905329532787219,8.762228689146546,9.6785194210207,8.379236436890439,9.6785194210207,8.831221560633498,7.973771328782275,8.985372240460755,8.905329532787219,9.16769379725471,9.524368741193442])",115.98914529466553
524009462345265153,Quando o Aécio começa a falar eu só escuto um monte de blá blá blá blá blá petrobas blá blá blá blá você está sendo leviana blá blá blá blá,"['aécio começa', 'começa falar', 'falar escuto', 'escuto monte', 'monte blá', 'blá blá', 'blá blá', 'blá blá', 'blá blá', 'blá petrobas', 'petrobas blá', 'blá blá', 'blá blá', 'blá blá', 'blá sendo', 'sendo leviana', 'leviana blá', 'blá blá', 'blá blá', 'blá blá']","(262144,[68866,99762,140481,149722,160530,199833,201400,210345,214012,235839,240563],[0.0,8.905329532787219,0.0,0.0,86.97690168008975,0.0,8.379236436890439,0.0,0.0,8.905329532787219,0.0])",113.16679718255463
522928423954808834,Qdo Aécio diz que Dilma quer governar MG ele quer dizer q se o PT perder o governo federal a cumpanherada vai baixar tudo aqui em Minas.,"['qdo aécio', 'aécio diz', 'diz dilma', 'dilma quer', 'quer governar', 'governar quer', 'quer dizer', 'dizer perder', 'perder governo', 'governo federal', 'federal cumpanherada', 'cumpanherada vai', 'vai baixar', 'baixar tudo', 'tudo aqui', 'aqui minas']","(262144,[23440,82854,86842,99157,116260,145460,159166,167338,173804,178690,179998,194716,224511,248254,259824,260223],[8.762228689146546,9.39083734856892,8.474546616694765,8.379236436890439,8.525839911082315,8.03629168576361,9.6785194210207,0.0,9.39083734856892,0.0,0.0,8.63706554619254,7.886759951792646,9.6785194210207,9.6785194210207,6.426853773329509])",112.94605557109232
522533501086621697,Horário político virou em Dilma acusa Aécio que acusa Dilma que acusa PSDB que acusa PT que acusa Aécio que acusa Dilma que acusa PSDB que..,"['horário político', 'político virou', 'virou dilma', 'dilma acusa', 'acusa aécio', 'aécio acusa', 'acusa dilma', 'dilma acusa', 'acusa psdb', 'psdb acusa', 'acusa acusa', 'acusa aécio', 'aécio acusa', 'acusa dilma', 'dilma acusa', 'acusa psdb']","(262144,[18361,35265,111658,118993,142756,161944,186924,211470,244813,260967],[18.33538759450942,19.048737482386883,0.0,28.17251204570676,8.525839911082315,0.0,18.78167469713784,0.0,0.0,18.14476723490077])",111.00891896572399
522876906798993408,'Ai nao vou votar no PT pq bla bla bla bla' 'Aecio sabe falar bem em debates e esta preparado e bla bla bla' 'Fui pra rua em junho bla bla',"['nao vou', 'vou votar', 'votar bla', 'bla bla', 'bla bla', 'bla bla', 'bla aecio', 'aecio sabe', 'sabe falar', 'falar bem', 'bem debates', 'debates preparado', 'preparado bla', 'bla bla', 'bla bla', 'bla pra', 'pra rua', 'rua junho', 'junho bla', 'bla bla']","(262144,[4253,13316,41664,56697,72669,74359,85853,109945,110118,174069,181059,186397,189936,198764,206726],[0.0,8.697690168008975,7.409835879702336,0.0,0.0,8.905329532787219,0.0,0.0,8.29222505990081,8.985372240460755,9.6785194210207,52.18614100805385,0.0,0.0,6.6419651529464545])",110.7970784628811
522863789331742720,"Dilma, pra variar, atacando o Aécio ao invés de falar sobre suas propostas e seu governo... Ta batendo o desespero #MudaBrasil #Aecio45","['dilma pra', 'pra variar', 'variar atacando', 'atacando aécio', 'aécio invés', 'invés falar', 'falar sobre', 'sobre propostas', 'propostas governo', 'governo batendo', 'batendo desespero', 'desespero mudabrasil', 'mudabrasil aecio45']","(262144,[9174,32869,33043,87174,100469,135847,137600,142252,159253,167391,178760,208655,222268],[9.273054312912537,9.6785194210207,9.524368741193442,0.0,9.6785194210207,9.524368741193442,9.6785194210207,9.524368741193442,7.9439183656325945,8.985372240460755,7.409835879702336,9.6785194210207,8.985372240460755])",109.8847369468321
522858756707598336,"""""""@JornalOGlobo: Aécio sobre Petrobras: 'a senhora sempre diz que não sabe de nada sobre esses casos. Então quem é responsável?' #DebateNoSBT""","['jornaloglobo aécio', 'aécio sobre', 'sobre petrobras', 'petrobras senhora', 'senhora sempre', 'sempre diz', 'diz sabe', 'sabe nada', 'nada sobre', 'sobre casos', 'casos então', 'então responsável', 'responsável debatenosbt']","(262144,[2086,19892,23972,99013,118224,130804,143012,169553,189059,230146,234994,242841,252231],[9.524368741193442,9.6785194210207,8.762228689146546,8.697690168008975,7.462945705016285,9.39083734856892,9.39083734856892,0.0,8.762228689146546,9.524368741193442,9.6785194210207,9.072383617450384,9.072383617450384])",109.01731150778524
522889730221178880,"🎷🎶🎶 ohhh Minas Gerais,  quem te conhece vota no Aécio,  ohhh Minas Gerais🎶🎵🎷🎷 ohhh Minas Gerais,  quem te conhece vota no Aécio🎶🎶🎶","['ohhh minas', 'minas gerais', 'gerais conhece', 'conhece vota', 'vota aécio', 'aécio ohhh', 'ohhh minas', 'minas gerais', 'gerais ohhh', 'ohhh minas', 'minas gerais', 'gerais conhece', 'conhece vota', 'vota aécio']","(262144,[34652,60437,65262,103129,128904,157004,231649],[17.05167982216463,17.299489246777664,15.829861657518684,8.251403065380556,12.021386752209194,29.0355582630621,9.524368741193442])",109.01374754830627
523848267080404994,PT usa fotos da esposa de Kadu Moliterno como sendo da esposa de Aécio. Quanta perversidade. @ElmoEdezio @fatimalima8 http://t.co/rqS5NugNen,"['usa fotos', 'fotos esposa', 'esposa kadu', 'kadu moliterno', 'moliterno sendo', 'sendo esposa', 'esposa aécio', 'aécio quanta', 'quanta perversidade', 'perversidade elmoedezio', 'elmoedezio fatimalima8', 'fatimalima8 httptcorqs5nugnen']","(262144,[33968,34002,56456,93604,107875,129625,173050,174112,178208,186749,233571,234645],[9.273054312912537,8.905329532787219,9.273054312912537,9.6785194210207,8.525839911082315,9.273054312912537,9.273054312912537,8.985372240460755,7.599077879340865,8.762228689146546,9.6785194210207,9.273054312912537])",108.50015865942177
522772136344449025,"""BEEI """"@Estadao: Lula ataca Aécio: Como alguém que se recusa a fazer o teste do bafômetro pode governar com decência? http://t.co/mS8ZSX4G26""""""","['beei estadao', 'estadao lula', 'lula ataca', 'ataca aécio', 'aécio alguém', 'alguém recusa', 'recusa fazer', 'fazer teste', 'teste bafômetro', 'bafômetro pode', 'pode governar', 'governar decência', 'decência httptcoms8zsx4g26']","(262144,[846,9041,35424,48926,82617,116337,124447,146464,167103,182322,194489,204821,223623],[8.251403065380556,0.0,8.174442024244426,9.16769379725471,9.524368741193442,9.39083734856892,8.985372240460755,9.6785194210207,8.762228689146546,9.273054312912537,8.212182352227273,9.273054312912537,9.273054312912537])",107.96621061823494
522878563322966016,"@OGloboPolitica @dilmabr Socorro! Dilma ficou presa no aeroporto de Claudio em Minas Gerais, enquanto Aécio está conquistando votos.","['oglobopolitica dilmabr socorro', 'dilmabr socorro dilma', 'socorro dilma ficou', 'dilma ficou presa', 'ficou presa aeroporto', 'presa aeroporto claudio', 'aeroporto claudio minas', 'claudio minas gerais', 'minas gerais enquanto', 'gerais enquanto aécio', 'enquanto aécio conquistando', 'aécio conquistando votos']","(262144,[3182,40330,55508,72907,122244,135889,159015,165835,200192,207281,230022,254242],[8.831221560633498,9.072383617450384,9.072383617450384,8.831221560633498,8.905329532787219,8.762228689146546,8.63706554619254,8.697690168008975,8.905329532787219,8.985372240460755,9.6785194210207,9.273054312912537])",107.65179979948425
522396781653803008,Será que a Rede Globo está sendo paga p/ toda hora falar mal do Aecio Neves Tá dando na cara! Coisa feia!A Dilma tá cada dia pior que todos,"['rede globo', 'globo sendo', 'sendo paga', 'paga toda', 'toda hora', 'hora falar', 'falar mal', 'mal aecio', 'aecio neves', 'neves dando', 'dando cara', 'cara coisa', 'coisa feiaa', 'feiaa dilma', 'dilma cada', 'cada dia', 'dia pior', 'pior todos']","(262144,[3859,6010,7767,14544,29461,63999,64311,64687,70189,71065,84935,119330,143811,144432,172828,175221,219832,254486],[9.6785194210207,0.0,0.0,9.524368741193442,6.414033084900447,0.0,8.379236436890439,0.0,9.524368741193442,9.273054312912537,9.16769379725471,9.524368741193442,9.6785194210207,0.0,7.914930828759342,8.985372240460755,0.0,8.425756452525333])",106.49022221932529
523146018066800640,"Aécio Neves fala que vai combater a corrupção, sendo que ele desviou dinheiro do povo pra construir um aeroporto particular, que absurdo","['aécio neves', 'neves fala', 'fala vai', 'vai combater', 'combater corrupção', 'corrupção sendo', 'sendo desviou', 'desviou dinheiro', 'dinheiro povo', 'povo pra', 'pra construir', 'construir aeroporto', 'aeroporto particular', 'particular absurdo']","(262144,[54747,56339,62947,73903,121844,135042,149657,150316,172923,177356,232439,237802,260027,261327],[9.16769379725471,9.16769379725471,0.0,9.072383617450384,8.762228689146546,9.6785194210207,9.39083734856892,9.524368741193442,0.0,9.39083734856892,9.6785194210207,4.636170151434917,8.579907132352592,9.273054312912537])",106.32221377817908
522869352224145408,"Bateu na mulher, roubou bilhões da saúde pública, e ainda quer ter moral, Aécio vai se fuder porra #EMABiggestFansJustinBieber #Beliebers","['bateu mulher', 'mulher roubou', 'roubou bilhões', 'bilhões saúde', 'saúde pública', 'pública ainda', 'ainda quer', 'quer ter', 'ter moral', 'moral aécio', 'aécio vai', 'vai fuder', 'fuder porra', 'porra emabiggestfansjustinbieber', 'emabiggestfansjustinbieber beliebers']","(262144,[39373,51444,70753,77361,112523,129202,140962,148847,164324,193296,203793,244697,254619,255440,260576],[5.483826884964318,9.6785194210207,0.0,8.138074380073553,0.0,9.524368741193442,0.0,9.39083734856892,9.6785194210207,8.762228689146546,9.072383617450384,8.831221560633498,9.273054312912537,8.985372240460755,8.985372240460755])",105.80377885790611
522873757917265920,"""aécio fala e só escuto """"blá blá blá minas gerais blá blá blá mentirosa blá blá blá minas gerais blá blá blá"""" #debatenosbt #dilminha13""","['aécio fala', 'fala escuto', 'escuto blá', 'blá blá', 'blá blá', 'blá minas', 'minas gerais', 'gerais blá', 'blá blá', 'blá blá', 'blá mentirosa', 'mentirosa blá', 'blá blá', 'blá blá', 'blá minas', 'minas gerais', 'gerais blá', 'blá blá', 'blá blá', 'blá debatenosbt', 'debatenosbt dilminha13']","(262144,[2551,5075,10232,36797,40786,60437,101579,160530,197503,200707,211458],[9.273054312912537,0.0,9.6785194210207,0.0,0.0,11.53299283118511,0.0,69.5815213440718,5.647232994765737,0.0,0.0])",105.71332090395589
523492868938145792,@ConversaAfiada Eo Famigerado Fator Previdênciario. FHC PAI MAQUIAVÉLICO DO FAMIGERADO FATOR PREVIDÊNCIARIO AECIO TIO MATANDO APOSENTADOS.,"['conversaafiada famigerado', 'famigerado fator', 'fator previdênciario', 'previdênciario fhc', 'fhc pai', 'pai maquiavélico', 'maquiavélico famigerado', 'famigerado fator', 'fator previdênciario', 'previdênciario aecio', 'aecio tio', 'tio matando', 'matando aposentados']","(262144,[5632,23468,39583,84308,85424,99157,135542,142049,155419,197447,246329],[17.39538033601795,8.831221560633498,0.0,9.072383617450384,9.273054312912537,8.379236436890439,17.27413109238508,8.697690168008975,8.697690168008975,8.831221560633498,8.985372240460755])",105.43738149340209
522879512800153600,Dilma passando mal Aécio deveria ser preso por abuso contra a mulher nesses debates cadê lei Maria da Penha (dúvida),"['dilma passando', 'passando mal', 'mal aécio', 'aécio deveria', 'deveria preso', 'preso abuso', 'abuso contra', 'contra mulher', 'mulher nesses', 'nesses debates', 'debates cadê', 'cadê lei', 'lei maria', 'maria penha', 'penha dúvida']","(262144,[54182,72928,79113,79369,101829,111011,139343,150820,167192,191177,199416,200205,230608,238174,249648],[9.6785194210207,0.0,9.16769379725471,7.973771328782275,7.265586270857789,7.973771328782275,8.212182352227273,9.273054312912537,8.985372240460755,8.379236436890439,9.524368741193442,9.39083734856892,0.0,0.0,8.905329532787219])",104.72972311173834
522585562679898112,Acho melhor devolver o país pros índios e pedir desculpas! Nem a Dilma nem o Aécio vão fazer bosta nenhuma .,"['acho melhor', 'melhor devolver', 'devolver país', 'país pros', 'pros índios', 'índios pedir', 'pedir desculpas', 'desculpas dilma', 'dilma aécio', 'aécio vão', 'vão fazer', 'fazer bosta', 'bosta nenhuma']","(262144,[51383,72729,75632,78125,110428,127211,177045,191054,205711,212317,219117,241052,251717],[9.16769379725471,9.6785194210207,0.0,9.16769379725471,8.379236436890439,9.6785194210207,8.251403065380556,9.273054312912537,9.6785194210207,8.579907132352592,8.29222505990081,4.715674790760794,9.16769379725471])",104.03014045302396
522578454513221633,"""— Dilma ou Aécio? — Dois hambúrgueres, alface, queijo molho especial, cebola picles num pão com gergelim.""""  NEEEEH?""","['dilma aécio', 'aécio dois', 'dois hambúrgueres', 'hambúrgueres alface', 'alface queijo', 'queijo molho', 'molho especial', 'especial cebola', 'cebola picles', 'picles pão', 'pão gergelim', 'gergelim neeeeh']","(262144,[76582,96245,109775,110679,129730,155180,159222,193643,235796,241052,242427,261496],[8.985372240460755,8.905329532787219,9.072383617450384,8.985372240460755,8.474546616694765,8.762228689146546,8.985372240460755,9.6785194210207,9.16769379725471,4.715674790760794,8.831221560633498,8.905329532787219])",103.46904427991812
523549912899010561,"""""""@lobaoeletrico: @rtoffoli e vamos todos pra Copacabana manhã mostar toda a força de Aécio no Rio ! A hora é essa!"""" http://t.co/7azqjVSCLm""","['lobaoeletrico rtoffoli', 'rtoffoli vamos', 'vamos todos', 'todos pra', 'pra copacabana', 'copacabana manhã', 'manhã mostar', 'mostar toda', 'toda força', 'força aécio', 'aécio rio', 'rio hora', 'hora httptco7azqjvsclm']","(262144,[4788,48108,84521,96405,99565,101698,110648,153305,156222,179971,189531,227369,242020],[0.0,9.524368741193442,8.697690168008975,9.16769379725471,0.0,9.524368741193442,9.39083734856892,9.524368741193442,9.072383617450384,9.6785194210207,9.16769379725471,9.6785194210207,9.6785194210207])",103.10496321518012
522876686786777089,gente eu nao queria falar nada nao mas eu acho que o aecio vai ficar na frente até o dia da votação e no final a dilma vai ganhar,"['gente nao', 'nao queria', 'queria falar', 'falar nada', 'nada nao', 'nao acho', 'acho aecio', 'aecio vai', 'vai ficar', 'ficar frente', 'frente dia', 'dia votação', 'votação final', 'final dilma', 'dilma vai', 'vai ganhar']","(262144,[13679,14282,14368,38274,38380,38689,56490,85138,87223,92048,132661,146467,178514,187593,230050,253791],[9.39083734856892,6.550297964420631,8.102983060262282,7.075829735576317,9.16769379725471,7.088252255574874,0.0,8.985372240460755,9.524368741193442,8.334784674319605,9.524368741193442,0.0,0.0,0.0,9.6785194210207,9.39083734856892])",102.81414532841461
522504111070384130,"Uma coisa se for pra entra um presidente desses dois aí Aécio e Dilma, e melhor devolver o Brasil pros índios e pedir desculpas.","['coisa pra', 'pra entra', 'entra presidente', 'presidente desses', 'desses dois', 'dois aécio', 'aécio dilma', 'dilma melhor', 'melhor devolver', 'devolver brasil', 'brasil pros', 'pros índios', 'índios pedir', 'pedir desculpas']","(262144,[6297,16032,59198,88276,109430,110428,115097,144230,177045,179971,191054,207415,214402,219117],[9.39083734856892,0.0,9.6785194210207,9.524368741193442,8.102983060262282,8.379236436890439,0.0,8.474546616694765,8.251403065380556,9.6785194210207,9.273054312912537,5.093551942350129,8.212182352227273,8.29222505990081])",102.35142777842256
522878085884956672,"@fafadbelem @CalcinhasNoBox Socorro! Dilma ficou presa no aeroporto de Claudio em Minas Gerais, enquanto Aécio está conquistando votos.","['fafadbelem calcinhasnobox', 'calcinhasnobox socorro', 'socorro dilma', 'dilma ficou', 'ficou presa', 'presa aeroporto', 'aeroporto claudio', 'claudio minas', 'minas gerais', 'gerais enquanto', 'enquanto aécio', 'aécio conquistando', 'conquistando votos']","(262144,[12793,12849,21579,60437,80073,86060,94302,148506,156035,156212,168277,201982,250832],[8.905329532787219,8.762228689146546,0.0,5.766496415592555,8.985372240460755,8.762228689146546,8.831221560633498,8.831221560633498,8.425756452525333,7.732609271965388,9.6785194210207,9.072383617450384,8.212182352227273])",101.9655498035897
522878563322966016,"@OGloboPolitica @dilmabr Socorro! Dilma ficou presa no aeroporto de Claudio em Minas Gerais, enquanto Aécio está conquistando votos.","['oglobopolitica dilmabr', 'dilmabr socorro', 'socorro dilma', 'dilma ficou', 'ficou presa', 'presa aeroporto', 'aeroporto claudio', 'claudio minas', 'minas gerais', 'gerais enquanto', 'enquanto aécio', 'aécio conquistando', 'conquistando votos']","(262144,[12793,12849,17457,60437,80073,86060,94302,94801,148506,156035,156212,201982,250832],[8.905329532787219,8.762228689146546,9.524368741193442,5.766496415592555,8.985372240460755,8.762228689146546,8.831221560633498,0.0,8.831221560633498,8.425756452525333,7.732609271965388,9.072383617450384,8.212182352227273])",101.81139912376244
